id	title	body
FW14-e015-7137-03	Televisión, cine y publicidad, fuentes de conocimiento del pasado y del presente	"Televisión, cine y publicidad, fuentes de conocimiento del pasado y del presente / Molina Rodríguez-Navas, Pedro (Universitat Autònoma de Barcelona. Departament de Periodisme i de Ciències de la Comunicació) ; Simelio Solà, Núria (Universitat Autònoma de Barcelona. Departament de Periodisme i de Ciències de la Comunicació) ; Ibarz Gelabert, Jordi (Universitat de Barcelona) 
Los medios de comunicación son una fuente de estudio del pasado y del presente que permiten mostrar la articulación de los cambios sociales colectivos con las transformaciones individuales. En este artículo presentamos un método de análisis que hemos experimentado con productos cinematográficos, televisivos y de publicidad. [...] 
Mass Media are a source of research for past and present knowledge that permit to show the articulation between social and collective changes with the individual transformations. In this article, we present a method of analysis that we have experimented with film, television and advertising products. [...] 
2013 
Historia y comunicación social, Vol. 18, Núm. Esp (Diciembre 2013), p. 461-471"
FW14-e015-7137-04	Modelos de mujeres fálicas del postfeminismo mediático : una aproximación a Millenium, Avatar y Los juegos del hambre	"Modelos de mujeres fálicas del postfeminismo mediático : una aproximación a Millenium, Avatar y Los juegos del hambre / Bernárdez Rodal, Asunción (Universidad Complutense de Madrid. Departamento de Periodismo III) 
Aquest article presenta una crítica cultural de tres pel·lícules de gran èxit de públic: Millenium 1, Avatar i The Hunger Games, analitzant un aspecte concret: la figura de les dones protagonistes, per argumentar que s'està produint un desplaçament en la representació convencional d'un model femení que la crítica feminista ha definit com a “dones fàl·liques”. [...] 
Este artículo presenta una crítica cultural de tres películas de gran éxito de público: Millenium 1, Avatar y Los juegos del hambre, analizando un aspecto concreto: la figura de las mujeres protagonistas, para argumentar que se está produciendo un desplazamiento en la representación convencional. 
de un modelo femenino que la crítica feminista ha definido como “mujeres fálicas”. Después de plantear la relación entre feminidad y violencia, el texto presenta una historia (aunque no sistemática) del término “heroína fálica” desarrollado en los años ochenta y noventa, para contrastarlo después con las protagonistas de las películas indicadas. [...] 
This article presents a cultural critique of three blockbuster movies: Millenium 1, Avatar and The Hunger Games, analyzing a particular aspect: the figure of women protagonists, arguing that a shift is occurring in the conventional representation of a model feminine, that feminist criticism has been defined as “phallic women”. [...] 
2012 
Anàlisi : quaderns de comunicació i cultura, Núm. 47 (Desembre 2012) , p. 91-112"
FW14-e015-7137-05	Get thee to a Nunnery. Teaching the Sociology of Religion through film	"Get thee to a Nunnery. Teaching the Sociology of Religion through film / Rippin, Frances (Gateway Sixth Form College (Leicester)) ; Wharton, David (Gateway Sixth Form College (Leicester)) 
Following Peter Whittaker’s inspiring workshops at the 2008 conference and his article in the Summer edition (“Going to the Movies: Visual Sociology"" SST 38/3), Social Science Teacher is offering an occasional series of pieces exploring the ways in which films, TV programmes, music and other products of popular culture can be used to develop students’ sociological understanding. [...] 
2009 
Social Science Teacher: the journal of the Association for the Teaching of the Social Sciences, Vol. 39, Núm. 1 (2009), p. 16-21  ; 
 UAB restricted access"
FW14-e015-7137-06	La generación digital ante un nuevo modelo de televisión : contenidos y soportes preferidos	"La generación digital ante un nuevo modelo de televisión : contenidos y soportes preferidos / González Aldea, Patricia (Universidad Carlos III de Madrid) ; López Vidales, Nereida (Universidad de Valladolid) 
Este artículo parte de un proyecto de investigación1 cuyo objetivo es descubrir las preferencias y hábitos de consumo de los jóvenes ante el nuevo modelo de televisión: la hipertelevisión. A la generación digital le gusta la televisión −según los primeros resultados de encuestas realizadas a jóvenes de 18-25 años−, pero está dejando de verla en la forma tradicional. [...] 
The starting point of this paper is a research project aimed to assess youth preferences and consumer habits regarding the new television model: the hypertelevision. The digital generation likes television, according to first results of surveys carried out among young people from 18 to 25 years old, but they are no longer watching it in the traditional way. [...] 
2011 
Anàlisi : quaderns de comunicació i cultura, Núm. 44 (Desembre 2011) , p. 31-48"
FW14-e015-7137-07	Las leyes de la atracción en los títulos de las películas de cine. Un caso de análisis de la vía heurística en la comunicación de masas	"Las leyes de la atracción en los títulos de las películas de cine. Un caso de análisis de la vía heurística en la comunicación de masas / Pastor, Lluís 
Este artículo plantea una aproximación sobre los elementos cognitivos que se utilizan en los títulos de las películas para persuadir a un público local para que vaya a ver la película. El estudio se centra en los títulos de las películas extranjeras que han sido modificados en su traducción al español antes de ser exhibidas al público. [...] 
This article explains an approach on the cognitive elements used in movie titles to persuade a local audience to watch a movie. The study focuses on the titles of foreign movies that have been modified in their translation into Spanish before they are exhibited in Spain. [...] 
Aquest article planteja una aproximació als elements cognitius que s'utilitzen en els títols de les pel·lícules per persuadir a un públic local perquè vagi a veure la pel·lícula. L'estudi se centra en els títols de les pel·lícules estrangeres que han estat modificats en la seva traducció a l'espanyol abans de ser exhibides al públic. [...] 
2011 
Anàlisi : quaderns de comunicació i cultura, Núm. 43 (2011) , p. 89-103"
FW14-e015-7137-08	La infancia en el peplum. Primeros apuntes	"La infancia en el peplum. Primeros apuntes / Lapeña Marchena, Óscar 
El presente trabajo es una aportación más al estudio sobre las relaciones entre el cine y el mundo antiguo. En esta oportunidad, abordamos el papel que la infancia desempeña en el género del peplum; la gran cantidad de ejemplos aportados, así como su exhaustivo análisis, nos permiten afirmar que el cine ha subrayado la supuesta decadencia del mundo antiguo, valiéndose para ello de diferentes recursos, uno de los cuales es la utilización de la infancia de un modo nada gratuito. 
The present work is one more contribution to the study of the relations between the movies and the Ancient World. In this opportunity we deal with the role played by childhood in the peplum; the great quantity of examples contributed, as well as its exhaustive analysis allow us to affirm that the movies have underlined the supposed decadence of the Ancient World, making use of different resources with this objective, among them the utilization of childhood in a way by no means arbitrary. 
2007 
Faventia, V. 29 n. 2 (2007) p. 173-187"
FW14-e015-7137-09	Cinema i educació (social). Tres mirades pedagògiques d’una mateixa pel·lícula. El cas de «Sleepers»	"Cinema i educació (social). Tres mirades pedagògiques d’una mateixa pel·lícula. El cas de «Sleepers» / Solé Blanch, Jordi ; Gómez Serra, Miquel ; Gimeno Soria, Xavier 
La verificació que la vida acadèmica està patint una revolució formal i de contingut obliga a recrear el discurs pedagògic introduint-hi elements molt heterogenis. Ressaltar els valors culturals dels diferents mitjans de comunicació ens permet destacar les potencialitats i l’ús del cinema com a instrument docent facilitador dels aprenentatges dels alumnes. [...] 
Nowadays, at the universities, there is the idea that the academic practice is undergoing under a formal and in deep revolution that it forces to recreate the academic dynamics and practice introducing new heterogeneous elements or reintroducing some old ones. [...] 
La verificación que la vida académica está sufriendo una revolución formal y de contenido obliga a recrear el discurso académico introduciendo elementos muy heterogéneos. Resaltar los valores culturales de los diferentes medios de comunicación nos permite destacar las potencialidades y el uso del cine como instrumento docente facilitador de los aprendizajes de los alumnos. [...] 
2008 
Educar, N. 41 (2008) p. 93-114"
FW14-e015-7137-10	La pasión por ver : inicios de la exhibición cinematográfica en Málaga (1896 – 1898)	"La pasión por ver : inicios de la exhibición cinematográfica en Málaga (1896 – 1898) / Sánchez, Inmaculada 
El artículo presenta los inicios de la historia del cine en Málaga, a finales del siglo XIX, a la vez que se plantea la necesidad de realizar una historia del cine, una linea entendida como vehículo cultural y un fiel espejo de la evolución social de un territorio. 
A l'article es presenten els inicis de la història del cinema a Màlaga, a finals del segle XIX, alhora que es planteja la necessitat de fer una història del cinema, una línea entesa com a vehicle cultural i un fidel mirall de l'evolució social d'un territori. 
The article focus on the starts of the movies’ history in Malaga, to ends of the 19th century, at the same time that the need to carry out a history of the movies, a line understood as cultural vehicle and a faithful mirror of the social territorial evolution. 
2004 
HMiC : Història Moderna i Contemporània, N. 2 (2004) p. 63-75"
FW14-e015-7207-01	Evolución tectónica y geomorfológica reciente de las cuencas de antepaís suratlásicas : cuencas de Missour y Ouarzazate	"Evolución tectónica y geomorfológica reciente de las cuencas de antepaís suratlásicas : cuencas de Missour y Ouarzazate / Pastor Castilla, Alvar ; Arboleya, María Luisa, dir. ; Teixell Cácharo, Antonio, dir. ; Universitat Autònoma de Barcelona. Departament de Geologia 
Esta tesis presenta un estudio sobre la neotectónica y la dinámica de la red fluvial en dos cuencas de antepaís de las cordilleras del Atlas de Marruecos, la cuenca de Ouarzazate, situada al sur del Alto Atlas, y la cuenca de Missour, al sur del Medio Atlas. [...] 
This thesis presents a thorough study about the neotectonics and the dynamics of the Quaternary river network in two foreland basins of the Atlas Mountains of Morocco, the Ouarzazate basin and the Missour Basin. [...] 
[Barcelona] : Universitat Autònoma de Barcelona, 2013"
FW14-e015-7207-02	Análisis multidisciplinar del fenómeno sismo-volcánico de El Hierro (julio 2011)	"Análisis multidisciplinar del fenómeno sismo-volcánico de El Hierro (julio 2011) / Acosta Armas, Laura ; Casillas Ruiz, Ramón ; Folch i Sancho, Albert ; Universitat Autònoma de Barcelona. Facultat de Ciències 
La erupción volcánica submarina de La Restinga (10 de octubre) ha permitido, por primera vez, poner en marcha el Plan Especial de Protección Civil y Atención de Emergencias por Riesgo Volcánico en la Comunidad Autónoma de Canarias. [...] 
L'erupció volcànica submarina de La Restinga (10 d'octubre) ha permès, per primera vegada, engegar el Pla Especial de Protecció Civil i Atenció d'Emergències per Risc Volcànic en la Comunitat Autònoma de Canàries. [...] 
The volcanic submarine eruption of “La Restinga” (October 10th) has allowed, for the first time, to start the Special Plan of Civil Protection and Emergency care for Volcanic Risk in the Canary Community. [...] 
2012 
2 documents"
FW14-e015-7207-03	Uranium reserve, nuclear fuel cycle delusion, CO2 emission from the sea, and electricity supply : reflections after the fuel meltdown of Fukushima nuclear power units	"Uranium reserve, nuclear fuel cycle delusion, CO2 emission from the sea, and electricity supply : reflections after the fuel meltdown of Fukushima nuclear power units / Mayumi, Kozo ; Polimeni, John M. ; Universitat Autònoma de Barcelona. Unitat d'Història Econòmica 
The Great Tohoku-Kanto earthquake and resulting tsunami has brought considerable attention to the issue of the construction of new power plants. We argue in this paper, nuclear power is not a sustainable solution to energy problems. [...] 
Universitat Autònoma de Barcelona. Unitat d'Història Econòmica 2011 (Documents de treball (Universitat Autònoma de Barcelona. Unitat d'Història Econòmica) ; 2011/13)"
FW14-e015-7207-04	Sequencing lifeline repairs after an earthquake : an economic approach	"Sequencing lifeline repairs after an earthquake : an economic approach / Casari, Marco ; Wilkie, Simon ; Universitat Autònoma de Barcelona. Unitat de Fonaments de l'Anàlisi Econòmica ; Institut d'Anàlisi Econòmica 
Recoveries after recent earthquakes in the U. S. and Japan have shown that large welfare gains can be achieved by reshaping current emergency plans as incentive-compatible contracts. We apply tools from the mechanisms design literature to show ways to integrate economic incentives into the management of natural disasters and discuss issues related to the application to seismic event recovery. [...] 
2006 (Working papers ; 587.03)"
FW14-e015-7207-06	Arc-parallel vs back-arc extension in the Western Gibraltar arc : is the Gibraltar forearc still active?	"Arc-parallel vs back-arc extension in the Western Gibraltar arc : is the Gibraltar forearc still active? / Balanyá, J.C. (Universidad Pablo de Olavide. Departamento de Sistemas Físicos, Químicos y Naturales) ; Crespo-Blanc, A. (Instituto Andaluz de Ciencias de La Tierra) ; Díaz-Azpiroz, M. (Universidad Pablo de Olavide. Departamento de Sistemas Físicos, Químicos y Naturales) ; Expósito, I. (Universidad Pablo de Olavide. Departamento de Sistemas Físicos, Químicos y Naturales) ; Torcal, F. (Instituto Andaluz de Geofísica y Prevención de Desastres Sísmicos) ; Pérez-Peña, V. (Universidad de Granada. Departamento de Geodinámica) ; Booth-Rea, G. (Universidad de Granada. Departamento de Geodinámica) 
Extremely tight arcs, framed within the Eurasia-Africa convergence region, developed during the Neogene on both sides of the western Mediterranean. A complex interplate deformation zone has been invoked to explain their structural trend-line patterns, the shortening directions and the development of back-arc basins. [...] 
2012 
Geologica acta, Vol. 10, Núm. 3 (setembre 2012) , p. 249-263"
FW14-e015-7207-08	The active fault belts in eastern Tibet margin inferred using magnetotellurics	"The active fault belts in eastern Tibet margin inferred using magnetotellurics / Zhao, G. (Institute of Geology, China Earthquake Administration) ; Wang, L. (Institute of Geology, China Earthquake Administration) ; Chen, X. (Institute of Geology, China Earthquake Administration) ; Tang, J. (Institute of Geology, China Earthquake Administration) ; Wan, Z. (Institute of Geology, China Earthquake Administration) ; Zhan, Y. (Institute of Geology, China Earthquake Administration) ; Xiao, Q. (Institute of Geology, China Earthquake Administration) ; Cai, J. (Institute of Geology, China Earthquake Administration) ; Zhang, J. (Earthquake Administration of Shandong Province) ; Wang, J. (Institute of Geology, China Earthquake Administration) 
A magnetotelluric (MT) sounding has been carried out in the eastern margin of the Tibetan plateau. The survey line is about 145 km long, trending in NEE direction and crossing the Daliangshan block in the eastern edge of the Tibetan plateau. [...] 
2010 
Geologica acta, Vol. 8, Núm. 1 (Març 2010) , p. 99-110"
FW14-e015-7207-10	El terratrèmol de l’11 de març del 2011 al Japó	"El terratrèmol de l’11 de març del 2011 al Japó / Aliberas, Joan (IES Josep Puig i Cadafalch, Mataró) ; Arboleya, María Luisa (Universitat Autònoma de Barcelona. Unitat de Geotectònica) 
El març passat un intens terratrèmol va sacsejar la costa oriental del Japó, produint un tsunami que va originar un nombre molt gran de víctimes i enormes danys materials. Vegem què va succeir. 
2011 
Ciències: revista del professorat de ciències de primària i secundària, Núm. 19 (Juny 2011) , p. 39-46"
