id	title	body
FW14-e015-7207-09	Deep crustal electromagnetic structure of Bhuj earthquake region (India) and its implications	"Deep crustal electromagnetic structure of Bhuj earthquake region (India) and its implications / Naganjaneyulu, K. (National Geophysical Research Institute, Council of Scientific and Industrial research (CSIR)) ; Ledo, J. J. (Universitat de Barcelona. Departament de Geodinàmica i Geofísica) ; Queralt, P. (Universitat de Barcelona. Departament de Geodinàmica i Geofísica) 
The existence of fluids and partial melt in the lower crust of the seismically active Kutch rift basin (on the western continental margin of India) owing to underplating has been proposed in previous geological and geophysical studies. [...] 
2010 
Geologica acta, Vol. 8, Núm. 1 (Març 2010) , p. 83-97"
FW14-e015-7211-01	Placing pauses in read spoken Spanish : a model and an algorithm	"Placing pauses in read spoken Spanish : a model and an algorithm / Marín Gálvez, Rafael (Universitat Autònoma de Barcelona. Departament de Filologia Espanyola) ; Aguilar, Lourdes (Universitat Autònoma de Barcelona. Departament de Filologia Espanyola) ; Casacuberta, David, 1967- (Universitat Autònoma de Barcelona. Departament de Filosofia) 
The purpose of this work is to describe the appearance and location of typographically unmarked pauses in any Spanish text to be read. An experiment is designed to derive pause location from natural speech: results show that Intonation Group length constraints guide the appearance of pauses, which are placed depending on syntactic information. [...] 
2002 
Language design : journal of theoretical and experimental linguistics, V. 4 (2002) p. 49-66"
FW14-e015-7207-07	Paleoseismic analysis of the San Vicente segment of the El Salvador Fault Zone, El Salvador, Central America	"Paleoseismic analysis of the San Vicente segment of the El Salvador Fault Zone, El Salvador, Central America / Canora, C. (Universidad Complutense de Madrid. Departamento de Geodinámica) ; Villamor, P. (GNS Science) ; Martínez Día, J.J. (Universidad Complutense de Madrid. Departamento de Geodinámica) ; Berryman, K.R. (GNS Science) ; Álvarez Gómez, J.A. (Universidad de Cantabria. Instituto de Hidráulica Ambiental “IH Cantabria”) ; Capote, R. (Universidad Complutense de Madrid. Departamento de Geodinámica) ; Hernández, W. (Servicio Nacional de Estudios Territoriales (El Salvador)) 
The El Salvador earthquake of February 13th 2001 (Mw 6. 6) was associated with the tectonic rupture of the El Salvador Fault Zone. Paleoseismic studies of the El Salvador Fault Zone undertaken after this earthquake provide a basis for examining the longer history of surface rupturing earthquakes on the fault. [...] 
2012 
Geologica acta, Vol. 10, Núm. 2 (June 2012) , p. 103-123"
FW14-e015-7207-05	Universal earthquake-ocurrence jumps, correlations with time, and anomalous diffusion	"Universal earthquake-ocurrence jumps, correlations with time, and anomalous diffusion / Corral Cano, Alvaro (Universitat Autònoma de Barcelona. Departament de Física) ; American Physical Society 
Spatiotemporal properties of seismicity are investigated for a worldwide (WW) catalog and for southern California in the stationary case (SC), showing a nearly universal scaling behavior. Distributions of distances between consecutive earthquakes (jumps) are magnitude independent and show two power-law regimes, separated by jump values about 200 (WW) and 15 km (SC). [...] 
2006 
Physical review letters, Vol. 97, Issue 17 (October 2006) , p. 178501"
FW14-e015-7015-01	La Inteligencia general (g), la eficiencia neural y el índice velocidad de conducción nerviosa : una aproximación empírica	"La Inteligencia general (g), la eficiencia neural y el índice velocidad de conducción nerviosa : una aproximación empírica / Bonastre Rovira, Rosa Maria ; Costa Molinari, Josep Maria dir. (Universitat Autònoma de Barcelona. Departament de Psiquiatria i Medicina Legal) 
Para valorar la asociación de las diferencias individuales en inteligencia psicométrica (CI) con las diferencias en eficiencia neural, utilizamos los potenciales evocados cerebrales visuales (VEP) y el índice de la velocidad de conducción nerviosa (VCN) en la vía visual derivado de ellos. [...] 
To value the association of individual differences in psychometric intelligence (IQ) with the differences for neural efficiency, we used the visual evoked cerebral potentials (VEP) and the index nerve conduction velocity (VCN) in a brain nerve pathway derived from them. [...] 
Bellaterra : Universitat Autònoma de Barcelona, 2005"
FW14-e015-7215-04	Cirugía reconstructiva con colgajos libres en el tratamiento de los carcinomas de cabeza y cuello : factores pronósticos clínicos y biológicos relacionados con la aparición de complicaciones	"Cirugía reconstructiva con colgajos libres en el tratamiento de los carcinomas de cabeza y cuello : factores pronósticos clínicos y biológicos relacionados con la aparición de complicaciones / López Fernández, Susana ; León i Vintró, Xavier, dir. ; Masià Ayala, Jaume, dir. ; Universitat Autònoma de Barcelona Departament de Cirurgia 
INTRODUCCIÓN: El objetivo del presente estudio es averiguar si existe una relación significativa entre el riesgo de aparición de complicaciones perioperatorias y el antecedente de radioterapia previa en los pacientes con tumores de cabeza y cuello reconstruidos con colgajos libres. [...] 
INTRODUCTION: The principal objective of the study is to determine if there is any meaningful relationship between the peri-operation complication risk and the radiotherapy history of patients with the head and neck tumors reconstructed with free flaps. [...] 
Bellaterra : Universitat Autònoma de Barcelona, 2013"
FW14-e015-7215-06	The System COX‐2/PGE2 in the keratinocyte inflammatory response and in cutaneous neoplasia in the dog	"The System COX‐2/PGE2 in the keratinocyte inflammatory response and in cutaneous neoplasia in the dog / Bardagí i Admetlla, Mar ; Ferrer i Caubet, Lluís dir. (Universitat Autònoma de Barcelona. Departament de Medicina i Cirurgia Animals) ; Fondevila Palau, M. Dolors dir. (Universitat Autònoma de Barcelona. Departament de Medicina i Cirurgia Animals) ; Universitat Autònoma de Barcelona. Departament de Medicina i Cirurgia Animals 
La ciclooxigenasa (COX)-2 i els seu metabòlit principal, la prostaglandina E2 (PGE2), són importants en la fisiologia cutània (maduració i proliferació dels queratinòcits) i la seva patofisiologia (processos de cicatrització, inflamació cutània i carcinogènesi). [...] 
Cyclooxygenase (COX)-2 and its main metabolite, prostaglandin E2 (PGE2), are important players in the skin physiology (maturation and proliferation of keratinocytes) and pathophysiology (wound healing, skin inflammation and carcinogenesis). [...] 
[Bellaterra] : Universitat Autònoma de Barcelona, 2012"
FW14-e015-7215-07	El Cociente ganglionar como predictor de supervivencia en los carcinomas escamosos de cabeza y cuello	"El Cociente ganglionar como predictor de supervivencia en los carcinomas escamosos de cabeza y cuello / López Vilas, Montserrat ; León i Vintró, Xavier, dir. ; Quer, Miquel, dir. ; Universitat Autònoma de Barcelona Departament de Cirurgia 
El cociente ganglionar o nodal ratio, definido como el cociente entre el número de adenopatías positivas dividido entre el número total de ganglios disecados, se ha comprobado como un factor pronóstico eficaz en diferentes tumores malignos. [...] 
The nodal ratio (ratio between metastatic nodes and examined lymph nodes) is an important prognostic variable in different solid malignancies. There are few studies about the nodal ratio (NR) in patients with squamous cell carcinoma of the head and neck (SCCHN) and most of these studies included only patients with tumors of the oral cavity. [...] 
Bellaterra : Universitat Autònoma de Barcelona, 2012"
FW14-e015-7215-08	Valoración de un método de clasificación y estadiaje de la segunda neoplasia de cabeza y cuello	"Valoración de un método de clasificación y estadiaje de la segunda neoplasia de cabeza y cuello / García Lorenzo, Jacinto ; Quer, Miquel, dir. ; León i Vintró, Xavier, dir. ; Universitat Autònoma de Barcelona Departament de Cirurgia 
Introducción. La aparición de segundos tumores metacrónicos tras el diagnóstico de un carcinoma escamoso de cabeza y cuello es uno de los principales obstáculos para la supervivencia a largo plazo de estos pacientes. [...] 
Introduction Metacrhonous second primary tumors are amongst the main obstacles that hamper long term survival after a head and neck squamous cell carcinoma. When compared with index tumors of the same stage and location, prognosis of second tumors is significantly worse. [...] 
Bellaterra : Universitat Autònoma de Barcelona, 2012"
FW14-e015-7215-09	Comparación de los factores pronósticos en los pacientes con carcinoma de cabeza y cuello a partir de dos metodologías diferentes : análisis multivariante versus análisis de partición recursiva	"Comparación de los factores pronósticos en los pacientes con carcinoma de cabeza y cuello a partir de dos metodologías diferentes : análisis multivariante versus análisis de partición recursiva / Avilés Jurado, Francisco Javier ; León i Vintró, Xavier (dir.) ; Universitat Autònoma de Barcelona Departament de Cirurgia 
El principal objetivo del esta tesis es llevar a cabo una comparación de los factores de riesgo que se obtienen a partir de un método estadístico clásico, como el modelo de riesgos proporcionales de Cox, y los resultados que se obtienen con un modelo de generación de árboles en pacientes con carcinomas escamosos de cabeza y cuello. [...] 
The main objective of this thesis is to conduct a comparison of risk factors obtained from a classical statistical method, as the model of Cox proportional hazards and the results obtained with a model of tree generation in patients with squamous cell carcinoma of head and neck. [...] 
Bellaterra : Universitat Autònoma de Bellaterra, DL 2010"
FW14-e015-7215-10	Vies de senyalització regulades per les Presenilines en càncer de pell : paper del receptor d'EGF	"Vies de senyalització regulades per les Presenilines en càncer de pell : paper del receptor d'EGF / Rocher Ros, Vidalba ; Saura Antolín, Carlos Alberto dir. (Universitat Autònoma de Barcelona. Departament de Bioquímica i de Biologia Molecular) 
Mutacions autosòmiques dominants en els gens de presenilines (PS) són la principal causa d'Alzheimer familiar hereditari. Aquestes mutacions alteren el metabolisme de l'APP i la generació del pèptid -amiloide, el qual s'acumula en forma de plaques en el cervell dels malalts d´Alzheimer. [...] 
Dominant autosomic mutations of presenilin (PS) genes are the most important cause of familiar Alzheimer disease. These mutations modify APP metabolism and -amiloid peptide generation, which is accumulated forming plaques on the brain of Alzheimer disease patients. [...] 
Bellaterra : Universitat Autònoma de Barcelona, 2009 
2 documents"
FW14-e015-7216-01	Affinity bioseparation and biosensing using magnetic particles for food safety	"Affinity bioseparation and biosensing using magnetic particles for food safety / Liébana Girona, Susana ; Alegret, Salvador, 1947- , dir. ; Pividori, María Isabel, dir. ; Universitat Autònoma de Barcelona. Departament de Química 
La presente Tesis describe el diseño y la evaluación de nuevas estrategias, tanto ópticas como electroquímicas, para la detección rápida de bacterias patógenas en seguridad alimentaria. En la misma, se evalúan diferentes plataformas electroquímicas, basadas principalmente en biocompósitos de grafito-epoxi así como en el acoplamiento de partículas magnéticas a compósitos de grafito-epoxi. [...] 
This dissertation reports the design and evaluation of novel strategies, based on both optical and electrochemical detection, for the rapid detection of pathogenic bacteria in food safety applications. [...] 
[Barcelona] : Universitat Autònoma de Barcelona, 2014"
FW14-e015-7216-02	Evaluación del desarrollo de aminas biógenas en queso chihuahua durante la vida de anaquel	"Evaluación del desarrollo de aminas biógenas en queso chihuahua durante la vida de anaquel / González Martínez, María Teresa ; González Martínez, Blanca Edelia, dir. ; Hernández Herrero, María Manuela ; Universitat Autònoma de Barcelona. Departament de Ciència Animal i dels Aliments 
La inocuidad de los alimentos constituye una de las preocupaciones de la industria de alimentos ya que afecta directamente a la salud de los consumidores. El queso chihuahua es el queso madurado de mayor consumo en México, la maduración se realiza mediante la adición de microorganismos lácticos, principalmente del género Lactococcus y en algunos casos también Streptococcus thermophilus y Lactobacillus. [...] 
Food safety is a concern in the food industry since it directly affects the consumer health. Chihuahua cheese is the mature cheese of major consumption in Mexico; the maturation is realized by adding lactic microorganisms, especially Lactococcus and in some cases Streptococcus thermophiles and Lactobacillus. [...] 
[Barcelona] : Universitat Autònoma de Barcelona, 2013"
FW14-e015-7216-03	Salmonella entry mechanisms known and to be discovered	"Salmonella entry mechanisms known and to be discovered / Santos Mayans, Paula ; Luquin Fernández, M. , dir. (Universitat Autònoma de Barcelona. Departament de Genètica i de Microbiologia) ; Universitat Autònoma de Barcelona. Facultat de Biociències 
2013 
Graduat o Graduada en Microbiologia [816]"
FW14-e015-7216-04	Estudio del regulón Fur en Salmonella enterica serovar Typhimurium	"Estudio del regulón Fur en Salmonella enterica serovar Typhimurium / Teixidó Devesa, Laura ; Barbé García, Jordi, dir. ; Campoy Sánchez, Susana, dir. ; Universitat Autònoma de Barcelona. Departament de Genètica i de Microbiologia 
El hierro es un oligoelemento esencial para la supervivencia celular ya que es un cofactor de muchas enzimas y forma parte de la estructura de muchas proteínas. Es por este motivo que los microorganismos necesitan mecanismos eficientes para la captación de hierro cuándo carecen del mismo. [...] 
Iron is an essential trace element for the cell since it is a cofactor for many enzymes and is a part of the structure of many proteins. It is for this reason that the microorganisms need efficient mechanisms for iron uptake when lacking it. [...] 
[Barcelona] : Universitat Autònoma de Barcelona, 2013"
FW14-e015-7216-05	Implicación del sistema SOS y de la proteína RecA en el proceso infectivo de Salmonella enterica sv. Typhimurium	"Implicación del sistema SOS y de la proteína RecA en el proceso infectivo de Salmonella enterica sv. Typhimurium / Medina Ruiz, Laura ; Barbé García, Jordi, dir. ; Campoy Sánchez, Susana, dir. ; Universitat Autònoma de Barcelona. Departament de Genètica i de Microbiologia 
El sistema SOS es una respuesta génica global muy extendida dentro del dominio Bacteria que se induce en presencia de lesiones en el DNA y permite la reparación del material genético y la supervivencia celular. [...] 
The SOS response is a wide-spread regulatory network in the Bacteria domain. Induction of this response occurs in the presence of DNA lesions and it is targeted to address DNA damage and to allow cell survival. [...] 
[Barcelona] : Universitat Autònoma de Barcelona, 2012"
FW14-e015-7216-06	Evaluation of the efficacy of Ultra-High Pressure Homogenization technology to improve the safety and quality of liquid foods and especially of orange juice	"Evaluation of the efficacy of Ultra-High Pressure Homogenization technology to improve the safety and quality of liquid foods and especially of orange juice / Velázquez Estrada, Rita María ; Roig Sagués, Artur X., dir. ; Hernández Herrero, María Manuela, dir. ; Universitat Autònoma de Barcelona Departament de Ciències Animals i dels Aliments 
El principal objetivo de esta tesis ha sido evaluar la capacidad de la tecnología de ultra alta presión de homogeneización (UHPH) como alternativa a la pasteurización convencional para garantizar la seguridad y calidad de los alimentos líquidos. [...] 
The main objective of this thesis has been to evaluate the capacity of the ultra-high pressure homogenization (UHPH) technology as alternative to the conventional pasteurization in ensuring the safety and quality of liquid foods. [...] 
[Barcelona] : Universitat Autònoma de Barcelona. Departament de Ciència Animal i dels Aliments, DL 2012"
FW14-e015-7216-07	La Desinfección basada en bacteriófagos como herramienta de biocontrol de Salmonella en alimentos	"La Desinfección basada en bacteriófagos como herramienta de biocontrol de Salmonella en alimentos / Spricigo, Denis Augusto ; Llagostera Casas, Montserrat, dir. ; Cortés Garmendia, M. Pilar, dir. ; Universitat Autònoma de Barcelona Departament de Genètica i Microbiologia 
Salmonella enterica es una de las principales causas de toxiinfección alimentaria en todo el mundo. Su transmisión a humanos generalmente se produce a través de productos de origen animal y, en menor medida, de origen vegetal. [...] 
Salmonella enterica is one of the leading causes of foodborne disease worldwide. This pathogen is usually transmitted to humans through animal products. However, in the last years, fresh vegetables are also an important source of transmission of Salmonella. [...] 
[Barcelona] : Universitat Autònoma de Barcelona. Departament de Genètica i de Microbiologia, DL 2012"
FW14-e015-7216-08	Impacte dels sistemes de reparació de lesions produïdes per agents alquilants en la virulència de Salmonella enterica ser. Typhimurium	"Impacte dels sistemes de reparació de lesions produïdes per agents alquilants en la virulència de Salmonella enterica ser. Typhimurium / Àlvarez Juste, Gerard ; Barbé García, Jordi dir. (Universitat Autònoma de Barcelona. Departament de Genètica i Microbiologia) ; Campoy Sánchez, Susana dir. (Universitat Autònoma de Barcelona. Departament de Genètica i Microbiologia) ; Universitat Autònoma de Barcelona Departament de Genètica i Microbiologia 
Salmonella enterica ser. Typhimurium (S. Typhimurium) és un enterobacteri patogen que afecta a diverses espècies de mamífers i que generalment causa infeccions lleus, com gastroenteritis, si bé pot arribar a generar malalties sistèmiques, produint septicèmia i, fins i tot, la mort de l'hoste infectat. [...] 
Salmonella enterica ser. Typhimurium (S. Typhimurium) is an enteropathogen able to infect several mammalian species, generally causing mild diseases, such as gastroenteritis, although it can also become a systemic infection, producing septicaemia and even the death of the infected host. [...] 
Bellaterra: Universitat Autònoma de Barcelona, DL 2010"
FW14-e015-7216-09	Nous dissenys biomoleculars en genosensors i immunosensors per a la seguretat alimentària	"Nous dissenys biomoleculars en genosensors i immunosensors per a la seguretat alimentària / Lermo Soria, Ana Isabel (Universitat Autònoma de Barcelona. Departament de Química) ; Alegret, Salvador, 1947- dir. (Universitat Autònoma de Barcelona. Departament de Química) ; Pividori Gurgo, María Isabel (dir.) ; Universitat Autònoma de Barcelona Departament de Química 
Al camp alimentari hi ha una creixent demanda de metodologies analítiques que siguin ràpides, selectives i econòmiques, que permetin la detecció de diferents contaminants alimentaris per a garantir la seguretat del producte al llarg de la cadena alimentària de producció. [...] 
The control of food quality along the food production chain has become of growing interest since the increasing incidence of food poisoning is a significant public health concern for customers worldwide. [...] 
Bellaterra: Universitat Autònoma de Barcelona, DL 2009"
FW14-e015-7216-10	Ribonucleotidil reductases de Salmonella enterica serovar typhimurium : regulació transcripcional i participació en la patogènesi	"Ribonucleotidil reductases de Salmonella enterica serovar typhimurium : regulació transcripcional i participació en la patogènesi / Panosa Borràs, Anaïs ; Gibert, Isidre dir. (Universitat de Barcelona. Departament de Genètica i Microbiologia) ; Roca Subirà, Ignasi dir. (Universitat de Barcelona. Departament de Genètica i Microbiologia) 
Salmonella enterica serovar Typhimurium (S. Typhimurium) és un patògen intracel·lular gram negatiu que provoca gastroenteritis en humans però que en ratolins provoca una infecció sistèmica similar a la febre tifoidea humana (provocada en aquest cas per S. [...] 
Salmonella enterica serovar Typhimurium (S. Typhimurium) is a gram negative intracellular human pathogen causing gastroenteritis in humans as well as a systemic infection in mice similar to human typhoid fever (which is caused by S. [...] 
Bellaterra : Universitat Autònoma de Barcelona, 2009"
FW14-e015-7263-01	Pseudomonas aeruginosa multiresistente : aspectos epidemiológicos, clínicos y terapéuticos	"Pseudomonas aeruginosa multiresistente : aspectos epidemiológicos, clínicos y terapéuticos / Montero, María Milagro ; Knobel Freud, Hernando Javier, dir. ; Horcajada Gallego, Juan Pablo, dir. ; Universitat Autònoma de Barcelona Departament de Medicina 
Introducción. Pseudomonas aeruginosa es bacilo gramnegativo no-fermentador responsable de una proporción elevada de las infecciones adquiridas en hospitales, en particular en las unidades de cuidados intensivos (UCI). [...] 
Background. Pseudomonas aeruginosa is non-fermentative Gram-negative bacillus responsible for a high proportion of infections acquired in hospitals, particularly in intensive care units (ICUs). Infections with P. [...] 
Bellaterra : Universitat Autònoma de Barcelona, DL 2013"
FW14-e015-7263-02	Utilidad de la proteína C reactiva como marcador pronóstico en niños con patología infecciosa grave	"Utilidad de la proteína C reactiva como marcador pronóstico en niños con patología infecciosa grave / Mingo Alemany, María Carmen de ; Carrascosa Lezcano, Antonio, dir. (Universitat Autònoma de Barcelona. Departament de Pediatria, d'Obstetrícia i Ginecologia i Medicina Preventiva) ; Modesto Alapont, Vicente, codir. (Universitat Autònoma de Barcelona. Departament de Pediatria, d'Obstetrícia i Ginecologia i Medicina Preventiva) 
Objetivo: Conocer la utilidad de la proteína C reactiva (PCR) como marcador pronóstico en pacientes en edad pediátrica (0-14 años), sin patología subyacente, que ingresan en el hospital por neumonía adquirida en la comunidad (NAC), meningitis bacteriana y pielonefritis aguda. [...] 
Objective: To determine the usefulness of C-reactive protein (CRP) as a prognostic marker in pediatric patients (0-14 years old), without underlying pathology, admitted to hospital for community-acquired pneumonia (CAP), bacterial meningitis, and acute pyelonephritis. [...] 
Bellaterra : Universitat Autònoma de Barcelona, DL2011"
FW14-e015-7263-03	Desarrollo, optimización y evaluación de nuevos métodos inmunológicos y moleculares en el diagnóstico de las infecciones causadas por Legionella pneumophilia	"Desarrollo, optimización y evaluación de nuevos métodos inmunológicos y moleculares en el diagnóstico de las infecciones causadas por Legionella pneumophilia / Blanco Palencia, Silvia ; Domínguez Benítez, José Antonio dir. (Universitat Autònoma de Barcelona. Departament de Genètica i de Microbiologia) ; Ausina Ruiz, Vicente dir. (Universitat Autònoma de Barcelona. Departament de Genètica i de Microbiologia) ; Universitat Autònoma de Barcelona Departament de Genètica i Microbiologia 
Legionella se identificó por primera vez en 1976. Es una bacteria ampliamente distribuida en la naturaleza, siendo su nicho natural el medio acuático. Es responsable del 3-15% de las neumonías adquiridas en la comunidad y es, asimismo, causa frecuente de neumonía intrahospitalaria. [...] 
Legionella was first identified in 1976. This bacterium's natural environment is the aquatic means, where it is widely extended. It is responsible for 3 to 15% of in the community-acquired pneumonia cases and a frequent cause of in-hospital developed pneumonia. [...] 
Bellaterra: Universitat Autònoma de Barcelona, DL 2010"
FW14-e015-7263-04	Colonización, citopatogenicidad y persistencia de Legionella spp. en agua sanitaria hospitalaria	"Colonización, citopatogenicidad y persistencia de Legionella spp. en agua sanitaria hospitalaria / García Núñez, Mª Ángeles 
La prevalencia ambiental de Legionella spp. en centros hospitalarios y la incidencia real de legionelosis nosocomial son datos por lo general mal conocidos o muy variables de unas áreas a otras. El primer paso para la identificación de la infección nosocomial por Legionella es demostrar la colonización del sistema de distribución hospitalaria para poder establecer un nexo epidemiológico. [...] 
The environmental prevalence of Legionella spp. in hospitals and the incidence of the nosocomial legionelosis are unkonwn data, variable between different areas. Demonstration of water-system contamination is the first step in identifying nosocomial Legionella infection in a hospital. [...] 
Bellaterra : Universitat Autònoma de Barcelona, DL 2009"
