id	title	body
FW14-e078-5003-09	Calling all Chemists - Switzerland	Are you a Chemist with at least two years experience within the pharmaceutical/production industry? Are your looking for a step up and you want to improve your scientific background in an amazing location? Then you are just one click away for a life changing opportunity . This is a great role which will give you exposure to both biotech and...
FW14-e078-5003-10	Java Developers x 6/ 7 - All Levels - Bristol - New Roles!!	Java Developers x 6/7 - All Levels - Bristol - New Roles!! Keywords: Java, J2EE, OOP, Spring, Hibernate, JSF, XML, SQL Commutable from Bristol, Bath, Newport, Chippenham, Swindon, Gloucester, Cheltenham, etc. A leading software house - based in Bristol - requires a number of Java Developers to join its growing and successful teams. Happyp to consider junior/graduet through to senior...
FW14-e078-5004-01	Head Chef	"Head Chef (Catering, Hotel, Cook) BLUH11076 Bournemouth £395 - £425 per week Our client understands that ""one size doesn't fit all."" Their well known hotels... night working. In February, March and November, ... early part of February. Holidays: 28 days paid holidays per annum This is a Blue Octopus Recruitment Ltd vacancy who are operating as an employment agency. Once you..."
FW14-e078-5004-02	Commercial Account Handler	Our Client are a well established Broker Group with offices across the South. They are seeking an experienced commercial account handler with exposure to general... renewal months are February, March, June and July. Key Tasks * Gaining an understanding of the client's business and assessing insurance needs * Negotiating renewals with insurers and clients * Taking instructions from clients and...
FW14-e078-5004-03	Design Engineer - Contract	Design Engineer - Contract Parker White Consulting are currently recruiting a Design Engineer to begin a contract who is proficient at Solidworks 3D modelling and... by Friday 25th February. Parker White Consulting Limited acts as an Employment Agency (perm) and as an Employment Business (contract). Keywords: mechanical engineer, design engineer, Solidworks, solid works, special purpose, automation, mechanised, machinery, converting, conveyor, ...
FW14-e078-5004-04	Apprentice Desktop Support Specialist	Apprentice Desktop Support Specialist Shortcode: 1744 Programme: IT Systems & networking L3 Town: Maidenhead Postcode: SL6 Salary: £150.00 per week Closing date: February 28 Company Profile This company is a rapidly growing US-based company of about 600 employees with worldwide offices whose products maximize the value of the software the world develops and uses. The leading provider of , , ...
FW14-e078-5004-05	Business Administration/ Receptionist Apprenticeship	Business Administration/ Receptionist Apprenticeship Shortcode: 1698 Programme: Business & administration L3 Town: London Postcode: SE1 Salary: £150.00 per week Closing date: February 28 Company Profile This company is a well-established company from the US that are breaking in to the UK market and expanding rapidly. Their business is in data integration that helps companies get more value from their data...
FW14-e078-5004-06	Customer Service Adviser	The Team This is an exciting opportunity for you to join our Operations team within our Broker department. In joining the team you will find... Closing Date: 25th February
FW14-e078-5004-07	Electronics Test Engineer	Electronics Test Engineer - 3-6 Month Contract - Based South East - £22-£25 per hour Ltd - Start Early February Electronics Background / Understanding of Electronic Principles / Can Specify Electronic Tests and Equipment / Open on Industry Background This major international company specialise in a variety of electronic and avionics systems in the civil and military aerospace sectors. They...
FW14-e078-5004-08	Process Capability Expert - Black Belt	Process Capability Expert - Black Belt Pharmaceutical Cheshire Permanent £45000 - £50000 Updated February 18, 2014 A global pharmaceutical manufacturer has a requirement of a Process Capability Expert with a Six Sigma Black Belt to be based at their state of the art manufacturing facility based in Cheshire. Role description The role will provide expert technical guidance for complex problem...
FW14-e078-5004-09	Firmware Engineer (C/ Embedded)	The Role The successful Firmware Engineer will join the company on a permanent basis and work in a team of industry experts made up of... taking place throughout February and March. If you are a qualifying Firmware Engineer and you are interested in hearing more apply as soon as possible. If this Firmware Engineer role isn't of interest to yourself, ...
FW14-e078-5004-10	Apprentice IT Engineer	Apprentice IT Engineer Shortcode: 1696 Programme: IT Systems & networking L3 Town: Aldridge Postcode: WS9 Salary: £180.00 per week Closing date: February 28 Company Profile This company is a fully diverse IT Support Company capable of meeting the supply and demand needs of virtually any company in any industry. This company provide products, solutions and services to business, whether you...
FW14-e078-5005-01	Support Worker - Portishead - Adults with Learning Disabilities	Salary: £7.50 - £10* Per Hour Benefits: PAYE or Umbrella/ LTD company payments, £200 Refer-a-friend scheme*, Free yearly DBS*, Free mandatory and service-specific training*, Excellent... of vulnerable individuals with learning disabilities and... about supporting individuals with learning disabilities who... in supporting adults with learning disabilities in... contributions* About us With more than 25 years' experience, Swiis have an unrivalled understanding...
FW14-e078-5005-02	Primary Teacher with a Specialism in Art to cover PPA	TeacherActive are currently seeking an experienced primary teacher to cover PPA in a centrally based Swansea Primary School. The position commences in May and is... to be confident with whole school teaching.... * Motivate pupils with enthusiastic, imaginative presentation;... up to date with changes and developments... evening; * Liaise with colleagues and working... will be rewarded with: * Market leading...
FW14-e078-5005-03	Teachers with Primary Experience, Bradford	Teachers with Primary Experience | Leeds Ca pita Education Resourcing is looking to appoint Teachers with Primary experience or Secondary Teachers wanting the transition into... to appoint Teachers with Primary experience or... a day basis with a view to... to provide you with work and to... ad-hoc, supply basis with the potential to move onto a full time position Apply...
FW14-e078-5005-04	Medical Advisor - With A Difference!	Medical Advisor role with a Difference! South East England Are you a GMC registered Medic wanting to break into Medical Affairs? Calling Clinical Research Physicians... Physicians or Medics with 2 years Clinical... information and liaise with Project Leaders and... in the industry. With unrivalled industry knowledge... and excellent links with hiring managers in... delighted to speak with you about the...
FW14-e078-5005-05	Site Manager with CPCS Apointed Person New Build Hoising	Description Job Title: Site Manager with CPCS Apointed Person Job Ref: SW/NB/CS/SM/HAR Location: Watford Sector: New Build, Social Housing Duration: On going Salary: £19-£23p/h Essential... experienced Site Manager with a valid CPCS... on relevant projects with supporting references from... will also liaise with the project team, be involved in progress meetings and ensure Health & Safety Policy is adhered to...
FW14-e078-5005-06	Property Solicitor With A Following- London	PROPERTY SOLICITOR WITH A FOLLOWING- LONDON THE FIRM An expanding high street firm in London, our client provides a variety of services to businesses and... and individuals alike. With forty years` experience... experienced Property Solicitor with a following. The... a qualified solicitor with a minimum of... literate PROPERTY SOLICITOR WITH A FOLLOWING- LONDON... build long-term relationships with all our clients...
FW14-e078-5005-07	LGV Class II Driver with HIAB	LGV Class II Driver with HIAB Bishops Waltham Branch Established in 1842 and still family owned today, Elliotts are Hampshire's leading Independent Builders Merchant with... Independent Builders Merchant with 11 branches strategically... Class 2 Driver with HIAB Licence based... is essential, together with a counter balance... our customers along with the ability to... to 5pm (flexibility with start and finish...
FW14-e078-5005-08	Internship with Medical Communications Agency	Internship with Medical Communications Agency - OPPORTUNITY FOR SCIENCE GRAD! REWARDS: £12,000 for a 6 month internship Fantastic role for someone looking to begin a... company Management team with extensive pharmaceutical industry... focus on quality with an ethos on... contracts and relationships with big pharmaceutical companies and works on a good range of brands in various therapy areas! Varied projects...
FW14-e078-5005-09	Application Support with networking skills	Application Support Analyst with networking skills - move into technical consultancy London c£30,000-£35,000 + bonus + benefits This is a superb opportunity with a dynamic... a superb opportunity with a dynamic software... application support specialist with strong knowledge of... strong technical skills with networking and Windows.... good team player with a friendly and... a fantastic role with great scope for...
FW14-e078-5005-10	Estimator - With Sales Experience	This leading supplier and installer of a range of high quality windows and doors are looking for an experienced and enthusiastic estimator/salesperson to join their... a small team with ambitions to grow... quotations. - Liaising with customers to ensure... meetings on site with the client, as... discussing technical requirements with manufacturers. - Following... Experience of liaising with customers, including architects...
FW14-e078-5006-01	Salesforce. com Technical Consultant - 6 Months - London	Salesforce.com Technical Consultant - London - £400-450pd - 6 Months - End User My client a global end user is looking for a Salesforce.com Technical... looking for a Salesforce.com Technical consultant. This... specific project. A Salesforce.com functional team is... following skills. -Ideally Salesforce.com certified Developer DEV401... of 18 Months Salesforce.com experience -A minimum... established market leading Salesforce.com recruitment business. We...
FW14-e078-5006-02	3 X Asp. Net Developer Agile C#Asp. Net Mvc Tdd Ecommerce . Com	3 X SENIOR AGILE ASP.NET DEVELOPER C#ASP.NET MVC TDD ECOMMERCE .COM. I am on the hunt for an ASP.Net MVC DEVELOPER to work a new ecommerce team in a AMAZING .COM that dates back 20 years and are investing lots of money in the ecommerce function. The role. C# ASP.NET 90% of my clients are in the online business sector...
FW14-e078-5006-03	CRM Consultant -YOU MUST HAVE NetSuite (Suitescript)& Salesforce. com	CRM Consultant - You MUST HAVE NetSuite (Suitescript) and Salesforce.com experience for this role - £400pd - Central London Spargonet Consulting, an IT Services Company, ... (Suitescript) Platform to Salesforce.com. The successful candidate... both Netsuite and Salesforce.com, having ideally worked on similar project previously. Skills and hands on experience required for this role;- - Salesforce - NetSuite (Suitescript) - Business Analysis...
FW14-e078-5006-04	Lead Architect/ Manager C#Asp. Net Mvc Soa Scrum Ecommerce . Com	LEAD ARCHITECT/MANAGER - SOA - C#ASP.NET MVC SCRUM TDD ECOMMERCE RETAIL COM. I am on the hunt for an ASP.Net MVC LEAD ARCHITECT AND MANAGER to run a new eCommerce team in a RETAIL company that dates back 20 years and are investing lots of money in THE eCommerce function. Ideal Person. Upbeat, Good man Manager, strong applications architecture in...
FW14-e078-5006-05	Lead Architect/ Manager C#Asp. Net Mvc Soa Scrum Ecommerce . Com	LEAD ARCHITECT/MANAGER - SOA - C#ASP.NET MVC SCRUM TDD ECOMMERCE RETAIL COM. I am on the hunt for an ASP.Net MVC LEAD ARCHITECT AND MANAGER to run a new eCommerce team in a RETAIL company that dates back 20 years and are investing lots of money in THE eCommerce function. Ideal Person. Upbeat, Good man Manager, strong applications architecture in...
FW14-e078-5006-06	Salesforce. com Developer £55, 000 - £65, 000	Salesforce.com Developer Needed for Multinational Media and Publishing Company! This global company are looking for Salesforce.com developer! This professional will This opportunity will offer extensive... are looking for Salesforce.com developer! This professional... years' experience in Salesforce.com development Experience with... extensive exposure to Force.com projects, implementations and... capabilities with the Salesforce.com platform. This is... and other exciting Salesforce.com opportunities in more...
FW14-e078-5006-07	Salesforce. com configuration/ administration expert - ASAP start	Salesforce.com configuration/administration expert - ASAP start I am currently seeking a Salesforce.com configuration/administration expert for a 6 month contract based in London. My client is... currently seeking a Salesforce.com configuration/administration expert for... much bought into Salesforce.com as a CRM... of 18 months Salesforce.com experience -Expert SFDC... experience -Hands on Salesforce.com configuration experience -Salesforce.com management experience -Strong... established market leading Salesforce.com recruitment business. We...
FW14-e078-5006-08	Salesforce. com Technical Architect - £85 - £95k England	Salesforce.com Technical Architect - £85 - £95k England One of the most successful Platinum Salesforce.com Partners on the globe is seeking a talented Salesforce Technical... most successful Platinum Salesforce.com Partners on the... great opportunity for Salesforce.com technical architect who... number of exciting force.com projects across a... wish. Key Skills -Salesforce.com Architecture experience -Define... implementation within the Salesforce.com platform -Salesforce Development...
FW14-e078-5006-09	Salesforce. com Administrator / London / £300-400 / Urgent	A financial services business based in London are recruiting for a Salesforce.com Administrator to fulfil an urgent project. You will be responsible for ensuring they... data, configuring the Salesforce.com system and creating... the following skills -Salesforce.com certified Administrator ADM... -Minimum 2 years Salesforce.com experience -Expert in Salesforce.com configuration -Experience in... established market leading Salesforce.com recruitment business. We... specialise within the Salesforce.com market place, and...
FW14-e078-5006-10	Salesforce. com Developer, Contract 6-9 months, £450-£550 per da	Salesforce.com Developer, Contract 6-9 months, £450-£550 per day My client, a market leading branding and advertising agency that have recently been recognised as branding agency... development; the successful Salesforce.com Developer will assist... and Big Machines. Salesforce.com Developer, Contract 6-9... end to end Salesforce.com projects -Excellent communicator... an immediate response r.woodhouse@masonfrank.com +44 (0) 20... established market leading Salesforce.com recruitment business. We...
FW14-e078-5007-01	Home Manager	Home Manager Home Manager Home Manager (RGN/RMN) Elderly Nursing Home \- Christchurch, Dorset - Full Time - £42,000 per annum My client is currently looking Home Manager (RGN/RMN) Elderly Nursing Home \- Christchurch, Dorset... looking for a Home Manager (RGN/RMN)to work... of their Nursing Homes based in Christchurch, ... requirements of their Home Manager. In return... and manage their home on a day...
FW14-e078-5007-02	Home Manager	Home Manager Home Manager (RGN/RMN) Elderly Nursing Home \- Bedford, Bedfordshire - Full Time - £40,000 per annum My client is currently looking for a (RGN/RMN) Elderly Nursing Home \- Bedford, Bedfordshire... looking for a Home Manager (RGN/RMN)to work... of their Nursing Homes based in Bedford, ... requirements of their Home Manager. In return... and manage their home on a day...
FW14-e078-5007-03	Home Manager	Home Manager Home Manager (RGN/RMN) Elderly Nursing Home \- Billingham, County Durham - Full Time - £40,000 per annum My client is currently looking for (RGN/RMN) Elderly Nursing Home \- Billingham, County... looking for a Home Manager (RGN/RMN)to work... of their Nursing Homes based in Billingham, ... requirements of their Home Manager. In return... and manage their home on a day...
FW14-e078-5007-04	Home Manager	White Recruitment are currently searching for a HOME MANAGER to commence work at a 60-bedded elderly nursing home in Oakington, 4 miles north of Cambridge, ... 60-bedded elderly nursing home in Oakington, 4... for an experienced Home Manager to commence... work at a home in Oakington (4... be an experience Home Manager with a... track record. The home are part of...
FW14-e078-5007-05	Home Manager	Home Manager, Newport, Learning Disabilities Home, Up to 27500PA Home Manager required for residential home based in Newport. The home is registered with the Care Disabilities Home, Up to 27500PA Home Manager required for residential home based in Newport. The home is registered with... small sized care home which provides residential... Learning Disabilities. The home is part of... group that provide homes across the UK....
FW14-e078-5007-06	Home Manager	White Recruitment are currently searching for a Home Manager to work at a Small elderly nursing home, giving general nursing care and Dementia.This is a... Small elderly nursing home, giving general nursing... career, with the home being part of... personal progression. The home is an 25-bed home, with an even... of care the home provides.As a Home Manager, you will...
FW14-e078-5007-07	Home Manager	Home Manager needed for purpose built Care Home and is on the outskirts of the inner city area of Nottingham. The home provides both residential... purpose built Care Home and is on... of Nottingham. The home provides both residential... needs. The nursing home and client specialises... group of 250 homes based throughout the... environment. The care home provider has a...
FW14-e078-5007-08	Home Manager	White Recruitment are currently searching for a HOME MANAGER to commence work at a 55-bedded elderly nursing home in Aylesbury, giving general nursing care and... 55-bedded elderly nursing home in Aylesbury, giving... for an experienced Home Manager to commence... work at a home in Aylesbury. The... be an experience Home Manager with a... track record. The home are part of...
FW14-e078-5007-09	Home Manager	White Recruitment are currently recruiting for a permanent Home Manager's role within a prestigious Medium sized nursing home in Horsham. The care home prides itself... Medium sized nursing home in Horsham. The care home prides itself on... for a like-minded Home Manager to join... - Ensure the home is compliant with... staff in the home \- Maintaining the... outside the nursing home such as Social...
FW14-e078-5007-10	Deputy Home Manager	Deputy Manager required to join elderly nursing home located within a beautiful part of Cheshire, The Care Home is a specially converted 64 bedded accommodation... Cheshire, The Care Home is a specially... complex with 2 homes, 1st home has nursing, respite... and the 2nd home has residential care. The nursing home and client specialises... group of 250 homes based throughout the...
FW14-e078-5008-01	Trainee Recruitment Consultant - Start Your Career Now!	Trainee Recruitment Consultant - multi-million pound turnover recruitment specialist! £21,000 basic, £35K OTE (uncapped commission) and company car scheme. Comprehensive award winning training programme for... globe, and therefore you'll earn more commission... each deal that you do! The Role... of cold calling. You will need to... new business vacancies. You will find candidates for your roles through headhunting, ... adverts and networking. You will prepare your...
FW14-e078-5008-02	Are you a NQT qualified this year ?	Capita Education Resourcing are currently recruiting all Newly Qualified Primary Teachers to work on supply from Easter 2014 in local Primary Schools. To be considered... Teacher : * You must be a... subject knowledge * You will be passionate, ... our responsibilities to you seriously, our aim... is to provide you with work in... and to ensure you are well supported...
FW14-e078-5008-03	Are you a Legal Assistant or Paralegal?	Are you looking for your next move into the Legal sector as A Paralegal or Legal Assistant? Are you qualified to LPC level or looking next move into... Legal Assistant? Are you qualified to LPC... this summer? Do you have Real Estate... this area? Can you travel to Central... support this. If you would like to... please apply sending your CV and covering...
