id	title	body
FW14-e102-7263-07	Pfizer Fights Deadly Bacteria And Wins	 
FW14-e102-7265-08	Global Warming Will Increase Tropical Forests	We've been told often enough that climate change is going to mean the disappearance of many or even most of the tropical forests. Something of a problem: although it seems that this might not be entirely true. At least one paper is arguing that an increase in CO2 will increase [...] read »
FW14-e102-7263-09	Innovation, Competition And The FDA	Recent regulations by the FDA have retarded innovation in the drug industry and caused harm to the health of the nation. read »
FW14-e102-7448-03	Cobbler's Shoes: Strategy Guru Michael Porter's Monitor Group Bankrupt	Català: Michael Porter. Česky: Michael Porter. Dansk: Michael Porter. Deutsch: Michael Porter. Español: Michael Porter. Suomi: Michael Porter. Bahasa Indonesia: Michael Porter. Nederlands: Michael Porter. ‪Norsk (bokmål)â¬: Michael Porter. Polski: Michael E. Porter. Português: Michael Porter. Српски / Srpski: Majkl Porter. Svenska: Michael [...] read »
FW14-e102-7448-01	Brooks Running Shoes Hit Their Stride	"Brooks Sports tried to go toe-to-toe with Nike across all sports, but couldn't keep pace. A renewed focus on performance running shoes helped the company take off. The subsidiary of Berkshire Hathaway is ""on fire"" says Warren Buffett. read »"
