id	title	body
FW14-e140-7044-07	A Clash of Kings (HBO Tie-in Edition): A Song of Ice and Fire: Book Two by George R.R. Martin (Mar 6, 2012)	 
FW14-e140-7044-05	A Feast for Crows: A Song of Ice and Fire (Game of Thrones) by George R.R. Martin (2006)	 
FW14-e140-7211-06	The Pocket Idiot's Guide to Grammar And Punctuation by Jay Stevenson Ph.D. (Jul 5, 2005)	 
FW14-e140-7448-04	Adidas Mens Adizero Boston 4 Running Shoes by adidas	 
FW14-e140-7448-05	Adidas Mens Snova Glide 5 atr Running Shoes by adidas	 
FW14-e140-7211-08	Comma Sense: A Fun-damental Guide to Punctuation by Richard Lederer and John Shore (Jul 10, 2007)	 
FW14-e140-7211-05	Say What?: The Fiction Writer's Handy Guide to Grammar, Punctuation, and Word Usage by C. S. Lakin (Feb 1, 2014)	 
FW14-e140-7448-08	Adidas Boston 3 Bright Pink/White Running Runner Fitness Womens Shoes g62758 by adidas	 
FW14-e140-7211-04	The Best Punctuation Book, Period: A Comprehensive Guide for Every Writer, Editor, Student, and Businessperson... by June Casagrande (Apr 15, 2014)	 
FW14-e140-7211-01	The Blue Book of Grammar and Punctuation: An Easy-to-Use Guide with Clear Rules, Real-World Examples, and Reproducible... by Jane Straus, Lester Kaufman and Tom Stern (Feb 10, 2014)	 
FW14-e140-7044-08	The Lands of Ice and Fire (A Game of Thrones) by George R.R. Martin (Oct 30, 2012)	 
FW14-e140-7448-01	ADIDAS Women's AdiZero Boston 3 by adidas	 
FW14-e140-7044-06	A Dance with Dragons: A Song of Ice and Fire: Book Five by George R.R. Martin (Oct 29, 2013)	 
FW14-e140-7448-02	New Balance Men's 990 Heritage Running Shoe by New Balance	 
FW14-e140-7044-04	A Game of Thrones: The Story Continues Books 1-4: A Game of Thrones, A Clash of Kings, A Storm of Swords, A Feast... by Martin, George R. R. (May 11, 2011)	 
FW14-e140-7044-02	A Game of Thrones (A Song of Ice and Fire, Book 1) by George R.R. Martin (Mar 22, 2011)	 
FW14-e140-7044-01	George R. R. Martin's A Game of Thrones 5-Book Boxed Set (Song of Ice and Fire series): A Game of Thrones, A Clash... by George R.R. Martin (Oct 29, 2013)	 
FW14-e140-7044-03	A Storm of Swords (A Song of Ice and Fire, Book 3) by George R.R. Martin (Mar 4, 2003)	 
FW14-e140-7307-03	Conflict After Cold War: Arguments on Causes of War and Peace (3rd Edition) by Richard K. Betts (Aug 2, 2007)	 
FW14-e140-7274-01	Violence in the Model City: The Cavanagh Administration, Race Relations, and the Detroit Riot of 1967 by Sidney Fine (Jul 30, 2007)	 
FW14-e140-7274-05	The Detroit riot of 1967, by Hubert G Locke (1969)	 
FW14-e140-7274-06	Scene From The Detroit Race Riot Canvas Print / Canvas Art - Artist Everett by Fine Art America	 
FW14-e140-7274-07	Detroit: Race Riots, Racial Conflicts, and Efforts to Bridge the Racial Divide by Joe T. Darden and Richard W. Thomas (Mar 1, 2013)	 
FW14-e140-7250-02	"BookFactory® Collagen Vascular Disease Log Book / Journal / Logbook - 120 Page, 8.5""x11"", Black Hardbound (XLog... by BookFactory"	 
FW14-e140-7307-01	Conflict After the Cold War: Arguments on Causes of War and Peace (4th Edition) by Richard K. Betts (Mar 5, 2012)	 
FW14-e140-7211-02	Merriam-Webster's Guide to Punctuation and Style by Merriam-Webster (Jan 2002)	 
FW14-e140-7211-03	English Grammar & Punctuation (Quick Study Academic) by Inc. BarCharts (May 31, 2012)	 
FW14-e140-7307-07	The Cold War: A Very Short Introduction by Robert J. McMahon (Jul 10, 2003)	 
FW14-e140-7236-09	Cancer Chemotherapy in Clinical Practice by Terrence Priestman (May 28, 2012)	 
FW14-e140-7111-02	Essentials of Negotiation by Roy J. Lewicki, Bruce Barry, David M. Saunders and John W. Minton (Jun 13, 2003)	 
FW14-e140-7326-01	Volcano Eruption by Digitalz Store (Jun 10, 2013)	 
FW14-e140-7111-07	How to Find a Job with Recruiters: $120000: How My Salary Jumped from $41,000 to $120,000 Overnight and How You... by Jamie Perry (Oct 14, 2013)	 
FW14-e140-7235-06	Gaco Gr1600 5g Gacoroof Silicone Roof Coating by GACO WESTERN	 
FW14-e140-7326-09	Life on Fire: Wildlife on the Volcano's Edge Season 1 [HD] 2013 CC	 
FW14-e140-7211-07	Punctuation & Capitalization Guide by Digital Partners (Mar 16, 2011)	 
FW14-e140-7235-01	Gaco Gr1626-5 5gallon Green Gacoroof Silicone Roof Coating by GACO WESTERN	 
FW14-e140-7448-09	myLife (TM) Sun Yellow Slim Bumper (Metal Buttons - 360 Degree Side Protector) Gel Flex Case for the iPhone 4/... by myLife Brand Products	 
FW14-e140-7211-10	The Associated Press Guide To Punctuation by Rene J. Cappon (Jan 7, 2003)	 
FW14-e140-7211-09	Standard Deviants School - English Punctuation, Program 1 - A Beginner's Guide 2004 NR	 
FW14-e140-7044-10	A Feast of Ice and Fire: The Official Game of Thrones Companion Cookbook by Chelsea Monroe-Cassel, Sariann Lehrer and George R.R. Martin (May 29, 2012)	 
FW14-e140-7235-09	Liquid Rubber 1 Gallon White by Pro Guard Coatings	 
FW14-e140-7235-02	Sashco Through The Roof Elastomeric Synthetic Rubber Caulk, Brush Grade, 1 Quart Can, Clear (Pack of 1) by Sashco	 
FW14-e140-7044-09	The World of Ice and Fire: The Untold History of Westeros and the Game of Thrones by George R.R. Martin, Elio Garcia and Linda Antonsson (Oct 28, 2014)	 
FW14-e140-7235-08	GR1600-1 1G SIL ROOF COATING by GACO WESTERN	 
FW14-e140-7235-07	Smart Roof 5 Gallon White High Solids One-coat Silicone Roof Coating by SMART ROOF	 
FW14-e140-7249-10	Mythical Monsters, Cryptozoology: A Study on the Dragon, Unicorn, Phoenix and Other Species (Forgotten Books) by Charles Gould (Dec 31, 2007)	 
FW14-e140-7250-01	Handbook of Patient Care in Vascular Diseases (Lippincott Williams & Wilkins Handbook Series) by Todd E. Rasmussen MD, W. Darrin Clouse MD FACS and Britt H. Tonnessen MD (Jun 3, 2008)	 
FW14-e140-7250-04	Vascular Neurology: Questions and Answers by Nancy Futrell and Dara G. Jamieson (Dec 30, 2007)	 
FW14-e140-7249-09	Living Monsters Dead Giants: Myths, Monsters and Ancient Giants by R.V. Daniels (Apr 2, 2012)	 
FW14-e140-7249-08	Mythical Monsters by Charles Gould (Mar 13, 2013)	 
FW14-e140-7249-07	Exploring Coastal Mississippi: A Guide to the Marine Waters and Islands by Scott B. Williams (Apr 22, 2004)	 
FW14-e140-7250-03	Vascular and Interventional Radiology: The Requisites (Expert Consult - Online and Print), 2e (Requisites in Radiology... by John A. Kaufman MD MS FSIR FCIRSE and Michael J. Lee MSc FRCPI FRCR FFR(RCSI) FSIR EBIR (Sep 2, 2013)	 
FW14-e140-7250-07	Management of Cardiovascular Disease in Women by Hanna Z. Mieszczanska and Gladys P. Velarde (Apr 30, 2014)	 
FW14-e140-7250-05	Organic Red Wine Serum De Cabernet By Artful U. Organic Red Grapes Are Bursting with Antioxidants! This Anti Aging... by Artful U	 
FW14-e140-7250-06	Renal Vascular Disease by Lilach O. Lerman and Stephen C. Textor (Mar 19, 2014)	 
FW14-e140-7235-10	Rust-Oleum 265494 12-Ounce Leak Seal Flexible Rubber Sealant, Black by Rust-Oleum	 
FW14-e140-7250-08	Pulmonary Arterial Hypertension and Interstitial Lung Diseases: A Clinical Guide by Robert P. Baughman, Roberto G. Carbone and Giovanni Bottino (Dec 23, 2008)	 
FW14-e140-7250-09	Diseases of the Breast by Jay R. Harris MD, Marc E. Lippman, C. Kent Osborne MD and Monica Morrow MD (Jun 18, 2009)	 
FW14-e140-7250-10	Pocket Medicine: The Massachusetts General Hospital Handbook of Internal Medicine (Pocket Notebook) by Marc S. Sabatine MD (Oct 7, 2013)	 
FW14-e140-7265-01	America's Prairies & Grasslands: Guide to Plants and Animals by Marianne D. Wallace (Sep 18, 2001)	 
FW14-e140-7265-02	Grasslands Road Rustling Leaves on Branch Stake Assortment, 41-Inch, Set of 3	 
FW14-e140-7265-03	Seeds of Hope: Wisdom and Wonder from the World of Plants by Jane Goodall, Michael Pollan and Gail Hudson (Apr 1, 2014)	 
FW14-e140-7265-04	Invasive Plants and Weeds of the National Forests and Grasslands of the Southwest Region	 
FW14-e140-7249-06	Trophy Bowhunting: Plan the Hunt of a Lifetime then Bag One for the Record Books by Rick Sapp (Sep 6, 2006)	 
FW14-e140-7249-04	Flora and Fauna of the Civil War: An Environmental Reference Guide by Kelby Ouchley (Nov 2010)	 
FW14-e140-7249-05	Dancing Otters and Clever Coyotes: Using Animal Energies, the Native American Way by Gary Buffalo Horn Man and Sherry Firedancer (Aug 26, 2009)	 
FW14-e140-7242-04	The Hague Child Abduction Convention: A Critical Analysis (Studies in Private International Law) by Rhona Schuz (Nov 27, 2013)	 
FW14-e140-7236-06	Saunders Solutions in Veterinary Practice: Small Animal Oncology, 1e by Rob D. Foale BSc BVetMed DSAM DipECVIM MRCVS and Jackie Demetriou BVetMed CertSAS DipECVS MRCVS (May 6, 2010)	 
FW14-e140-7236-05	Drugs in Cancer Care by Rachel Midgley, Mark R. Middleton, Andrew Dickman and David Kerr (Jul 24, 2013)	 
FW14-e140-7236-07	Canine and Feline Geriatric Oncology: Honoring the Human-Animal Bond by Alice Villalobos and Laurie Kaplan (Jan 23, 2007)	 
FW14-e140-7236-08	Cancer Chemotherapy in Clinical Practice by Terrence Priestman (Dec 11, 2007)	 
FW14-e140-7236-04	Canine and Feline Dermatology Drug Handbook by Sandra N. Koch, Sheila M. F. Torres and Donald C. Plumb (May 1, 2012)	 
FW14-e140-7236-10	Diagnosis and Management of Melanoma in Clinical Practice by Nigel Kirkham, Dennis W.K. Cotton, Roger C. Lallemand and John E. White (Dec 31, 2013)	 
FW14-e140-7242-01	Hague Convention on International Child Abduction Applicable Law and Institutional Framework Within Certain Convention... by U. S. Government Printing Office (Aug 13, 2013)	 
FW14-e140-7265-06	Nature Connection With David Suzuki: Grassland 2012	 
FW14-e140-7242-02	The Hague Abduction Convention: Practical Issues and Procedures for the Family Lawyer by Jeremy D. Morley (Apr 7, 2014)	 
FW14-e140-7242-03	The 1996 Hague Convention on the Protection of Children by Nigel Lowe and Michael Nicholls QC (Dec 3, 2012)	 
FW14-e140-7242-05	The Hague Convention on International Child Abduction (Oxford Monographs in Private International Law) by Paul R. Beaumont and Peter E. McEleavy (Nov 25, 1999)	 
FW14-e140-7236-01	Lomustine: An entry from Thomson Gale's <i>Gale Encyclopedia of Cancer, 2nd ed.</i> by Paul, Ed.M. Johnson (2006)	 
FW14-e140-7242-06	Forum Non Conveniens: History, Global Practice, and Future under the Hague Convention on Choice of Court Agreements... by Ronald A. Brand and Scott R. Jablonski (Jul 27, 2007)	 
FW14-e140-7236-03	Evidence-Based Pediatric Oncology by Ross Pinkerton, A. G. Shankar and Katherine Matthay (May 28, 2013)	 
FW14-e140-7242-07	Hague Convention cases translated in Japanese: Japan Joins Hague Convention (Japanese Edition) by Kokusai Rikon (Mar 31, 2014)	 
FW14-e140-7242-08	The Hague Convention on Jurisdiction and Judgments by E Andreas Lowenfeld and Linda J. Silberman (Dec 1, 2001)	 
FW14-e140-7242-09	Practical Handbook on the Operation of the Hague Service Convention by Christophe Bernasconi and Laurence Thébault (Sep 17, 2013)	 
FW14-e140-7242-10	Inside the Adoption Agency: Understanding Intercountry Adoption in the Era of the Hague Convention by Jean Nelson-Erichsen (Mar 14, 2007)	 
FW14-e140-7249-01	Alligators, Sharks & Panthers: Deadly Encounters with Florida's Top Predator - Man by Charles Sobczak (Nov 16, 2006)	 
FW14-e140-7236-02	Gale Encyclopedia of Cancer: Lomustine by Ed.M. Paul A. Johnson (Dec 16, 2004)	 
FW14-e140-7249-02	Everglades Patrol by Tom Shirley (Sep 9, 2012)	 
FW14-e140-7249-03	Java Generics and Collections by Maurice Naftalin and Philip Wadler (Oct 24, 2006)	 
FW14-e140-7265-05	Grasslands Road Frog Figurine Tomato Garden Marker, 27-Inch, Set of 3	 
FW14-e140-7015-01	The Raven 2012 R	 
FW14-e140-7265-07	Rooster Chicken Bird Feathers Grassland Apple Ipad Mini Retina Display Flip Case Stand Smart Magnetic Cover Open... by Liil iPad Mini Retina Display Case	 
FW14-e140-7448-06	Barefoot in Boston: A Practical Guide To Achieving Injury Resolution And Enhancing Performance by Arthur Horne, Shaun P Bossio, Kate Gillette and Mark Toomey (Aug 11, 2011)	 
FW14-e140-7326-08	DK Readers: Eruption!: The Story of Volcanoes by Anita Ganeri (Mar 1, 2010)	 
FW14-e140-7326-10	Graphics and More Volcano Volcanic Eruption - Snap On Hard Protective Case for Apple iPhone 4 4S - Pink - Carrying... by Graphics and More	 
FW14-e140-7441-01	Football World Cup 2014: Soccer Champions League by T-Bull Sp. z o.o. (Apr 12, 2013)	 
FW14-e140-7441-02	Football Worldwide by Porcupyne Inc (Mar 9, 2014)	 
FW14-e140-7441-03	EURO 2012 Live by Vubooo (Mar 15, 2012)	 
FW14-e140-7441-04	World Cup Football: Champions League Soccer by T-Bull Sp. z o.o. (Apr 3, 2013)	 
FW14-e140-7441-05	Tricky Shot Flick Soccer (Football) by Dream Apps Lab (Mar 1, 2013)	 
