id	title	body
FW14-e144-7044-09	A Dance With Dragons (Hardcover)	* A Dance With Dragons (Hardcover) Today: EUR 25.78 4.7 (12 reviews) Add to Cart
FW14-e144-7044-02	A Song of Ice and Fire: A Game of Thrones, a Clash of Kings, a Storm of Swords, a Feast for Crows, and a Dance Wi... (Paperback)	* A Song of Ice and Fire: A Game of Thrones, a Clash of Kings, a Storm of Swords, a Feast for Crows, and a Dance Wi... (Paperback) Today: EUR 56.33 Add to Cart
FW14-e144-7044-06	A Clash of Kings (CD-Audio)	* A Clash of Kings (CD-Audio) Today: EUR 54.17 Add to Cart
FW14-e144-7044-05	A Storm of Swords (Paperback)	* A Storm of Swords (Paperback) Today: EUR 16.33 Add to Cart
FW14-e144-7044-04	A Dance with Dragons (Paperback)	* A Dance with Dragons (Paperback) Today: EUR 16.53 Add to Cart
FW14-e144-7261-01	A Gateway to Sindarin: A Grammar of an Elvish Language from J. R. R. Tolkien's Lord of the Rings (Paperback)	* A Gateway to Sindarin: A Grammar of an Elvish Language from J. R. R. Tolkien's Lord of the Rings (Paperback) Today: EUR 25.86 5.0 (1 reviews) Add to Cart
FW14-e144-7211-06	The Best Punctuation Book, Period: A Comprehensive Guide for Every Writer, Editor, Student, and Businessperson (Paperback)	* The Best Punctuation Book, Period: A Comprehensive Guide for Every Writer, Editor, Student, and Businessperson (Paperback) Today: EUR 11.47 Add to Cart
FW14-e144-7044-03	A Clash of Kings (Paperback)	* A Clash of Kings (Paperback) Today: EUR 15.31 Add to Cart
FW14-e144-7044-08	The Lands of Ice and Fire: Maps from King's Landing to Across the Narrow Sea (Sheet map, folded)	* The Lands of Ice and Fire: Maps from King's Landing to Across the Narrow Sea (Sheet map, folded) Today: EUR 31.37 5.0 (1 reviews) Add to Cart
FW14-e144-7215-01	Treatment of Esophageal and Hypopharingeal Squamous Cell Carcinoma (Hardcover)	* Treatment of Esophageal and Hypopharingeal Squamous Cell Carcinoma (Hardcover) Today: EUR 225.46 Add to Cart
FW14-e144-7044-10	A Storm of Swords (Hardcover)	* A Storm of Swords (Hardcover) Today: EUR 22.73 Add to Cart
FW14-e144-7211-02	A Dash of Style: The Art and Mastery of Punctuation (Paperback)	* A Dash of Style: The Art and Mastery of Punctuation (Paperback) Today: EUR 14.00 Add to Cart
FW14-e144-7137-05	Garfield: The Movie/Garfield: A Talk Of Two Kitties (Blu-ray Disc)	* Garfield: The Movie/Garfield: A Talk Of Two Kitties (Blu-ray Disc) Today: EUR 18.17 Add to Cart
FW14-e144-7274-03	Detroit: Race Riots, Racial Conflicts, and Efforts to Bridge the Racial Divide (Paperback)	* Detroit: Race Riots, Racial Conflicts, and Efforts to Bridge the Racial Divide (Paperback) Today: EUR 24.04 Add to Cart
FW14-e144-7211-01	Comma Sense: A Fun-damental Guide to Punctuation (Paperback)	* Comma Sense: A Fun-damental Guide to Punctuation (Paperback) Today: EUR 11.78 Add to Cart
FW14-e144-7137-03	Garfield: The Movie/Garfield: A Tale Of Two Kitties (DVD)	* Garfield: The Movie/Garfield: A Tale Of Two Kitties (DVD) Today: EUR 11.04 4.0 (1 reviews) Add to Cart
FW14-e144-7215-02	The Eggplant Cancer Cure: A Treatment for Skin Cancer and New Hope for Other Cancers from Nature's Pharmacy (Hardcover)	* The Eggplant Cancer Cure: A Treatment for Skin Cancer and New Hope for Other Cancers from Nature's Pharmacy (Hardcover) Today: EUR 19.62 Add to Cart
FW14-e144-7137-06	Garfield 2 Movie Collection (DVD)	* Garfield 2 Movie Collection (DVD) Today: EUR 18.22 Add to Cart
FW14-e144-7211-05	Clean, Well-Lighted Sentences: A Guide to Avoiding the Most Common Errors in Grammar and Punctuation (Paperback)	* Clean, Well-Lighted Sentences: A Guide to Avoiding the Most Common Errors in Grammar and Punctuation (Paperback) Today: EUR 12.18 Add to Cart
FW14-e144-7211-09	Random House Webster's Grammar, Usage, and Punctuation (Paperback)	* Random House Webster's Grammar, Usage, and Punctuation (Paperback) Today: EUR 11.55 Add to Cart
FW14-e144-7211-08	Punctuation and Spelling: Rules That Make Things Clear (Hardcover)	* Punctuation and Spelling: Rules That Make Things Clear (Hardcover) Today: EUR 27.51 Add to Cart
FW14-e144-7044-01	Beyond the Wall: Exploring George R. R. Martin's A Song of Ice and Fire, from A Game of Thrones to A Dance with D... (Paperback)	* Beyond the Wall: Exploring George R. R. Martin's A Song of Ice and Fire, from A Game of Thrones to A Dance with D... (Paperback) Today: EUR 12.03 Add to Cart
FW14-e144-7448-01	White Boston Traveler Men's Lightweight Lace-Up Running Shoes	* White Boston Traveler Men's Lightweight Lace-Up Running Shoes Sale: EUR 46.00 Add to Cart
FW14-e144-7211-07	Grammatically Correct: The Essential Guide to Spelling, Style, Usage, Grammar, and Punctuation (Paperback)	* Grammatically Correct: The Essential Guide to Spelling, Style, Usage, Grammar, and Punctuation (Paperback) Today: EUR 17.26 Add to Cart
FW14-e144-7274-01	The 1967 Detroit Riots (Hardcover)	* The 1967 Detroit Riots (Hardcover) Today: EUR 41.41 Add to Cart
FW14-e144-7242-04	Looting and Rape in Wartime: Law and Change in International Relations (Hardcover)	* Looting and Rape in Wartime: Law and Change in International Relations (Hardcover) Today: EUR 73.14 Add to Cart
FW14-e144-7242-05	Biological & Chemical Warfare (Hardcover)	* Biological & Chemical Warfare (Hardcover) Today: EUR 36.43 Add to Cart
FW14-e144-7265-01	Plants of Arizona (Paperback)	* Plants of Arizona (Paperback) Today: EUR 22.77 Add to Cart
FW14-e144-7265-02	Food of the Gods: The Search for the Original Tree of Knowledge : A Radical History of Plants, Drugs, and Human Ev... (CD-Audio)	* Food of the Gods: The Search for the Original Tree of Knowledge : A Radical History of Plants, Drugs, and Human Ev... (CD-Audio) Today: EUR 35.07 Add to Cart
FW14-e144-7211-10	English Essentials: What Every College Student Needs to Know About Grammar, Punctuation, and Usage (Paperback)	* English Essentials: What Every College Student Needs to Know About Grammar, Punctuation, and Usage (Paperback) Today: EUR 42.11 Add to Cart
FW14-e144-7274-02	Zug Island: A Detroit Riot Novel (Paperback)	* Zug Island: A Detroit Riot Novel (Paperback) Today: EUR 16.85 Add to Cart
FW14-e144-7242-02	Battered Women, Their Children, and International Law: The Unintended Consequences of the Hague Child Abduction C... (Paperback)	* Battered Women, Their Children, and International Law: The Unintended Consequences of the Hague Child Abduction C... (Paperback) Today: EUR 39.79 Add to Cart
FW14-e144-7211-04	Help Your Kids with Language Arts: A Step-by-step Visual Guide to Grammar, Punctuation, and Writing (Paperback)	* Help Your Kids with Language Arts: A Step-by-step Visual Guide to Grammar, Punctuation, and Writing (Paperback) Today: EUR 17.53 Add to Cart
FW14-e144-7293-01	Cake Simple: Recipes for Bundt-Style Cakes from Classic Dark Chocolate to Luscious Lemon Basil (Hardcover)	* Cake Simple: Recipes for Bundt-Style Cakes from Classic Dark Chocolate to Luscious Lemon Basil (Hardcover) Today: EUR 16.10 Add to Cart
FW14-e144-7293-02	The Artisan Soda Workshop: 70 Homemade Recipes from Fountain Classics to Plum Vanilla, Rhubarb Basil, Sea Salt Li... (Paperback)	* The Artisan Soda Workshop: 70 Homemade Recipes from Fountain Classics to Plum Vanilla, Rhubarb Basil, Sea Salt Li... (Paperback) Today: EUR 12.32 Add to Cart
FW14-e144-7293-03	Favorite Recipes With Herbs: Using Herbs in Everyday Cooking (Paperback)	* Favorite Recipes With Herbs: Using Herbs in Everyday Cooking (Paperback) Today: EUR 19.45 Add to Cart
FW14-e144-7211-03	Clean, Well-Lighted Sentences: A Guide to Avoiding the Most Common Errors in Grammar and Punctuation (Hardcover)	* Clean, Well-Lighted Sentences: A Guide to Avoiding the Most Common Errors in Grammar and Punctuation (Hardcover) Today: EUR 18.65 Add to Cart
FW14-e144-7242-03	Choice-of-Court Agreements Under the European and International Instruments: The Revised Brussels I Regulation, t... (Hardcover)	* Choice-of-Court Agreements Under the European and International Instruments: The Revised Brussels I Regulation, t... (Hardcover) Today: EUR 223.03 Add to Cart
FW14-e144-7230-02	Mayday - Bushido Karaoke	* Mayday - Bushido Karaoke Today: EUR 13.23 Add to Cart
FW14-e144-7242-01	Heritage Under Siege: Military Implementation of Cultural Property Protection Following the 1954 Hague Convention (Hardcover)	* Heritage Under Siege: Military Implementation of Cultural Property Protection Following the 1954 Hague Convention (Hardcover) Today: EUR 140.01 Add to Cart
FW14-e144-7230-01	Insiders' Guide to Omaha & Lincoln (Paperback)	* Insiders' Guide to Omaha & Lincoln (Paperback) Today: EUR 15.31 Add to Cart
FW14-e144-7222-05	L'Arc En Ciel - Bless	* L'Arc En Ciel - Bless Today: EUR 11.39 Add to Cart
FW14-e144-7222-04	L'Arc-En-Ciel - Real	* L'Arc-En-Ciel - Real Today: EUR 54.17 Add to Cart
FW14-e144-7222-03	Heavy Tin - Fused Jazz	* Heavy Tin - Fused Jazz Today: EUR 18.06 Add to Cart
FW14-e144-7222-02	Godzilla Flip - Kamakaze Attack	* Godzilla Flip - Kamakaze Attack Today: EUR 16.56 Add to Cart
FW14-e144-7222-01	Route 666 (DVD)	* Route 666 (DVD) Today: EUR 13.70 5.0 (2 reviews) Add to Cart
FW14-e144-7216-08	How to Prevent Food Poisoning: A Practical Guide to Safe Cooking, Eating, and Food Handling (Hardcover)	* How to Prevent Food Poisoning: A Practical Guide to Safe Cooking, Eating, and Food Handling (Hardcover) Today: EUR 23.06 Add to Cart
FW14-e144-7216-07	How to Prevent Food Poisoning: A Practical Guide to Safe Cooking, Eating, and Food Handling (Paperback)	* How to Prevent Food Poisoning: A Practical Guide to Safe Cooking, Eating, and Food Handling (Paperback) Today: EUR 14.92 Add to Cart
FW14-e144-7216-05	Salmonella Men on Planet Porno (Paperback)	* Salmonella Men on Planet Porno (Paperback) Today: EUR 14.99 Add to Cart
FW14-e144-7216-04	Salmonella Dub - Freak Controller Madness	* Salmonella Dub - Freak Controller Madness Today: EUR 32.94 Add to Cart
FW14-e144-7216-03	Salmonella (Hardcover)	* Salmonella (Hardcover) Today: EUR 32.98 Add to Cart
FW14-e144-7216-02	Clorox Disinfecting Wipes (Case of 6)	* Clorox Disinfecting Wipes (Case of 6) Today: EUR 52.01 Add to Cart
FW14-e144-7216-01	Clorox Bleach-Free Disinfecting Wipes (Case of 6)	* Clorox Bleach-Free Disinfecting Wipes (Case of 6) Today: EUR 48.75 Add to Cart
FW14-e144-7216-06	The End of Food (Paperback)	* The End of Food (Paperback) Today: EUR 12.57 Add to Cart
FW14-e144-7015-01	Baltimore Ravens Flag/ Pole	* Baltimore Ravens Flag/ Pole Today: EUR 27.24 Add to Cart
FW14-e144-7293-04	Cool Basil from Garden to Table: How to Plant, Grow, and Prepare Basil (Hardcover)	* Cool Basil from Garden to Table: How to Plant, Grow, and Prepare Basil (Hardcover) Today: EUR 27.80 Add to Cart
FW14-e144-7307-08	War & Conflict in Africa (Paperback)	* War & Conflict in Africa (Paperback) Today: EUR 24.02 Add to Cart
FW14-e144-7307-10	Diminishing Conflicts in Asia and the Pacific: Why Some Subside and Others Don't (Hardcover)	* Diminishing Conflicts in Asia and the Pacific: Why Some Subside and Others Don't (Hardcover) Today: EUR 138.73 Add to Cart
FW14-e144-7326-01	Erupting Volcano Model	* Erupting Volcano Model Today: EUR 42.26 Add to Cart
FW14-e144-7326-02	Curiosity Kits-Lava Rock Volcano	* Curiosity Kits-Lava Rock Volcano Today: EUR 19.09 Add to Cart
FW14-e144-7326-03	Slinky 'All About Volcanoes' Activity Kit	* Slinky 'All About Volcanoes' Activity Kit Today: EUR 22.75 Add to Cart
FW14-e144-7326-04	POOF-Slinky All About Volcanoes	* POOF-Slinky All About Volcanoes Today: EUR 29.25 Add to Cart
FW14-e144-7326-05	Smithsonian Giant Volcano Science Kit with Glow-in-the-dark Lava	* Smithsonian Giant Volcano Science Kit with Glow-in-the-dark Lava Today: EUR 18.42 4.0 (1 reviews) Add to Cart
FW14-e144-7326-06	Set of 2 Handcrafted Mango Wood 'Volcanoes' Vases (Thailand)	* Set of 2 Handcrafted Mango Wood 'Volcanoes' Vases (Thailand) Today: EUR 44.42 Add to Cart
FW14-e144-7326-07	Scientific Explorer Lava-Blasting Volcano Kit	* Scientific Explorer Lava-Blasting Volcano Kit Today: EUR 28.16 Add to Cart
FW14-e144-7326-08	Uncle Milton National Geographic Fire and Ice Volcano	* Uncle Milton National Geographic Fire and Ice Volcano Today: EUR 15.16 Add to Cart
FW14-e144-7326-09	Why Do Volcanoes Erupt? (Hardcover)	* Why Do Volcanoes Erupt? (Hardcover) Today: EUR 32.03 Add to Cart
FW14-e144-7326-10	Fiery Volcano: The Eruption of Mount St. Helens (Hardcover)	* Fiery Volcano: The Eruption of Mount St. Helens (Hardcover) Today: EUR 26.76 Add to Cart
FW14-e144-7328-01	Pharmagel 0.5-ounce Pharma Clear Acne Treatment	* Pharmagel 0.5-ounce Pharma Clear Acne Treatment Today: EUR 37.62 Add to Cart
FW14-e144-7328-02	Golden Caviar Skin Care Acne Treatment Gel	* Golden Caviar Skin Care Acne Treatment Gel Today: EUR 52.01 Add to Cart
FW14-e144-7328-03	Dr. Dennis Gross Skincare Hydra-Pure Intense Moisture Cream	* Dr. Dennis Gross Skincare Hydra-Pure Intense Moisture Cream Today: EUR 75.84 Add to Cart
FW14-e144-7448-02	Boston Traveler Men's Composite Lace-up Running Shoes	* Boston Traveler Men's Composite Lace-up Running Shoes Sale: EUR 31.17 Add to Cart
FW14-e144-7448-03	Boston Traveler Men's Topstitched Genuine Leather Belt	* Boston Traveler Men's Topstitched Genuine Leather Belt Sale: EUR 25.97 Add to Cart
FW14-e144-7448-04	Boston Traveler Men's Topstitched Black/Brown Leather Belt	* Boston Traveler Men's Topstitched Black/Brown Leather Belt Sale: EUR 26.21 Add to Cart
FW14-e144-7307-09	Causes, Course and Outcomes of World War Two (Hardcover)	* Causes, Course and Outcomes of World War Two (Hardcover) Today: EUR 121.81 Add to Cart
FW14-e144-7307-07	Sunset over the Islands: The Caribbean in an Age of Global and Regional Challenges (Hardcover)	* Sunset over the Islands: The Caribbean in an Age of Global and Regional Challenges (Hardcover) Today: EUR 124.62 Add to Cart
FW14-e144-7293-05	Fresh Italian Cooking (Paperback)	* Fresh Italian Cooking (Paperback) Today: EUR 17.18 Add to Cart
FW14-e144-7307-06	Faith (Paperback)	* Faith (Paperback) Today: EUR 14.58 Add to Cart
FW14-e144-7293-06	Cooking with Herbs: 50 Simple Recipes for Fresh Flavor (Hardcover)	* Cooking with Herbs: 50 Simple Recipes for Fresh Flavor (Hardcover) Today: EUR 14.23 Add to Cart
FW14-e144-7293-07	Jeffrey Saad's Global Kitchen: Recipes Without Borders (Paperback)	* Jeffrey Saad's Global Kitchen: Recipes Without Borders (Paperback) Today: EUR 19.26 Add to Cart
FW14-e144-7299-01	Sevylor Colossus 2-person Boat with Oars	* Sevylor Colossus 2-person Boat with Oars Today: EUR 60.94 Add to Cart
FW14-e144-7299-02	Shunsuke Yamamoto 'Row Boat in Pond' Canvas Art Print	* Shunsuke Yamamoto 'Row Boat in Pond' Canvas Art Print Today: EUR 86.68 Add to Cart
FW14-e144-7299-03	Row Boat Awaits' by Danita Delimont Framed Art Print	* Row Boat Awaits' by Danita Delimont Framed Art Print Today: EUR 86.68 Add to Cart
FW14-e144-7299-04	Cornelis Christiaan Dommelshuizen 'A Ship Becalmed and a Rowing Boat' Oil on Canvas Art	* Cornelis Christiaan Dommelshuizen 'A Ship Becalmed and a Rowing Boat' Oil on Canvas Art Today: EUR 108.36 Add to Cart
FW14-e144-7299-05	Paper House 300 Piece 'Row Of Bunnies' Jigsaw Shaped Puzzle	* Paper House 300 Piece 'Row Of Bunnies' Jigsaw Shaped Puzzle Today: EUR 13.00 Add to Cart
FW14-e144-7299-06	Impo Women's 'Row' Basic Textile Sandals (Size 6 )	* Impo Women's 'Row' Basic Textile Sandals (Size 6 ) Sale: EUR 35.54 Add to Cart
FW14-e144-7299-07	Boy Rowing the Boat 18-inch Velour Throw Pillow	* Boy Rowing the Boat 18-inch Velour Throw Pillow Today: EUR 46.59 Add to Cart
FW14-e144-7299-08	Ultimate 2-row Bling 6-inch Collar	* Ultimate 2-row Bling 6-inch Collar Today: EUR 21.67 4.2 (5 reviews) Add to Cart
FW14-e144-7299-09	Kenneth Cole Reaction Men's 'C-Row Bar' Basic Textile Casual Shoes (Size 8.5)	* Kenneth Cole Reaction Men's 'C-Row Bar' Basic Textile Casual Shoes (Size 8.5) Today: EUR 60.68 Add to Cart
FW14-e144-7299-10	Kenneth Cole Reaction Men's 'C-Row Bar' Basic Textile Casual Shoes	* Kenneth Cole Reaction Men's 'C-Row Bar' Basic Textile Casual Shoes Today: EUR 65.01 Add to Cart
FW14-e144-7307-01	Dynarex Instant Cold Pack (Pack of 24)	* Dynarex Instant Cold Pack (Pack of 24) Today: EUR 19.49 Add to Cart
FW14-e144-7307-02	PCH Reusable Hot/Cold Back Pad	* PCH Reusable Hot/Cold Back Pad Today: EUR 33.59 Add to Cart
FW14-e144-7307-03	Cool Relief Soft Gel Hip Ice Wrap with Removable Insert	* Cool Relief Soft Gel Hip Ice Wrap with Removable Insert Today: EUR 41.17 5.0 (1 reviews) Add to Cart
FW14-e144-7307-04	Arctic Ice System	* Arctic Ice System Today: EUR 119.19 5.0 (2 reviews) Add to Cart
FW14-e144-7307-05	Noble Cause: A Suspense Novel Set in the Cold War About the B-47 Bomber and the Men Who Flew Her (Paperback)	* Noble Cause: A Suspense Novel Set in the Cold War About the B-47 Bomber and the Men Who Flew Her (Paperback) Today: EUR 17.92 Add to Cart
FW14-e144-7293-08	Saving Dinner: The Menus, Recipes, and Shopping Lists to Bring Your Family Back to the Table (Paperback)	* Saving Dinner: The Menus, Recipes, and Shopping Lists to Bring Your Family Back to the Table (Paperback) Today: EUR 14.83 Add to Cart
FW14-e144-7207-04	At Risk: Earthquakes and Tsunamis on the West Coast	* At Risk: Earthquakes and Tsunamis on the West Coast Today: EUR 22.87 Add to Cart
FW14-e144-7207-10	Terremoto / Earthquake (Hardcover)	* Terremoto / Earthquake (Hardcover) Today: EUR 23.35 Add to Cart
FW14-e144-7111-01	Bright Starts Start Your Senses Zebra Plush Pal	* Bright Starts Start Your Senses Zebra Plush Pal Today: EUR 15.16 5.0 (1 reviews) Add to Cart
FW14-e144-7092-03	simplehuman Rectangular Step Brushed Stainless Steel Recycler Trash Can (12 Gallons)	* simplehuman Rectangular Step Brushed Stainless Steel Recycler Trash Can (12 Gallons) Today: EUR 195.05 4.8 (4 reviews) Add to Cart
